{
  "$schema": "http://json-schema.org/draft-07/schema#",
  "$id": "https://github.com/Tyler-Reagan/skills-bank/docs/meta-schema.json",
  "title": "SkillMeta",
  "type": "object",
  "required": ["name", "description"],
  "additionalProperties": true,
  "properties": {
    "name": {
      "type": "string",
      "pattern": "^[a-z0-9][a-z0-9-]*$",
      "minLength": 1,
      "maxLength": 64
    },
    "description": {
      "type": "string",
      "minLength": 1,
      "maxLength": 280
    },
    "domain": {
      "type": "string",
      "enum": ["code", "content", "data", "design", "meta", "other"]
    },
    "tags": {
      "type": "array",
      "items": { "type": "string" },
      "uniqueItems": true,
      "maxItems": 16
    },
    "version": {
      "type": "string",
      "pattern": "^\\d+\\.\\d+\\.\\d+(-[A-Za-z0-9.-]+)?$"
    },
    "author": { "type": "string" }
  }
}
