{
  "name": "carousel",
  "description": "When the user wants to design, optimize, or audit carousel/slider layouts for content display. Also use when the user mentions \"carousel,\" \"slider,\" \"carousel layout,\" \"testimonial carousel,\" \"gallery carousel,\" \"quote carousel,\" \"image slider,\" or \"carousel accessibility.\" For hero-area patterns, use hero-generator.",
  "version": "1.1.0",
  "domain": "meta"
}
