{
  "name": "competitor-research",
  "description": "When the user wants to analyze competitors for SEO, content, backlinks, or positioning. Also use when the user mentions \"competitor analysis,\" \"competitor research,\" \"competitor keywords,\" \"competitor backlinks,\" \"link gap,\" \"content gap,\" \"competitor content,\" \"competitive analysis,\" or \"competitor comparison.\" For content roadmap, use content-strategy.",
  "version": "1.2.1",
  "domain": "meta"
}
