{
  "name": "api-page-generator",
  "description": "When the user wants to create, optimize, or audit the API introduction/overview page. Also use when the user mentions \"API page,\" \"API landing page,\" \"/api page,\" \"API overview,\" \"developer landing,\" \"API marketing,\" or \"API for developers.\" Note: API documentation (endpoint reference) lives in docs; use docs-page-generator.",
  "version": "1.0.1",
  "domain": "meta"
}
