{
  "name": "web-design-guidelines",
  "description": "Review UI code for Web Interface Guidelines compliance. Use when asked to \"review my UI\", \"check accessibility\", \"audit design\", \"review UX\", or \"check my site against best practices\".",
  "version": "1.0.0",
  "author": "vercel",
  "domain": "meta"
}
