{
  "name": "vite",
  "description": "Vite build tool configuration, plugin API, SSR, and Vite 8 Rolldown migration. Use when working with Vite projects, vite.config.ts, Vite plugins, or building libraries/SSR apps with Vite.",
  "version": "2026.1.31",
  "author": "Anthony Fu",
  "domain": "meta"
}
