{
  "name": "core-web-vitals",
  "description": "When the user wants to optimize Core Web Vitals, fix LCP, INP, or CLS issues. Also use when the user mentions \"Core Web Vitals,\" \"CWV,\" \"LCP,\" \"INP,\" \"CLS,\" \"FID,\" \"page speed,\" \"page performance,\" \"Largest Contentful Paint,\" \"Interaction to Next Paint,\" \"Cumulative Layout Shift,\" or \"Page Experience.\" For GSC CWV, use google-search-console.",
  "version": "1.0.1",
  "domain": "meta"
}
