{
  "name": "content-optimization",
  "description": "When the user wants to optimize content for SEO—word count, H2 keywords, keyword density, multimedia, tables, lists. Also use when the user mentions \"content length,\" \"word count,\" \"keyword stuffing,\" \"H2 keywords,\" \"keyword density,\" \"tables,\" \"bullet points,\" or \"content structure.\" For keywords, use keyword-research.",
  "version": "1.2.1",
  "domain": "meta"
}
